[
  {
    "orderID": "SALES123",
    "ID":"SALESLINE12156",
    "businessCreationDate": "2016-01-02T10:22:50Z",
    "customerProductReference": "CUSTPROD",
    "directDelivery": false,
    "grossMarginTwo": {
      "value": 22,
      "timestampOfCalculation": "2016-02-17T17:22:35Z"
    },
    "packaging": {
      "ID": "74",
      "description": "plastic bag 25 kg"
    },
    "printedProductDescription": "This is the product description that will be printed",
    "product": {
      "ID": "123",
      "brandName": "DOW",
      "color": {
        "ID": "123",
        "description": "BLACK"
      },
      "grade": "LDPE",
      "producerColorCode": "DARK"
    },
    "quantity": {
      "quantity": 750,
      "unitCode": "kg",
      "isEditable":true
    },
    "stateChecks": [
      {
        "check": "AVAILABILITY",
        "value": "NOT_ASSIGNED"
      },
      {
        "check": "COMMERCIAL_VIABILITY",
        "value": "APPROVED"
      },
      {
        "check": "CREDIT",
        "value": "NOT_ASSIGNED"
      }
    ],
    "status": "Accepted",
    "unitPrice": {
      "amount": 1.25,
      "unitCode": "kg"
    },
    "version": 1
  }
]